question,response
那么您刚刚介绍说，这个quanting中是先生成低频的，后生成高频的吗？我想问一下，这个低频，高频是怎么理解的？  实质怎么的低频，高频？,就是从这个时  时间上低频，高频。  我们对就是时间维度做这个负点变化。
对对时间维度做负点变换？,对对，就是低频的分量相当于，是比较粗糙，就是它随时间几乎是不变的，那块。就是比如，在做一个，我们再做一个抓取任务的时候，你这个 比如，  就是手臂的运动， 几乎是 呈现一些低频的，然后手指的运动比较高频，因为它随时间需要一直变。
就相当于，比如，说我，我，我这个动作是，是，是，是是一个时，一个时，一个时，一个时十个维度向量，相当于在这个时间轴上，分别看这十个维度，他们的这个 变化了这个  就是这个幅度是吧？如果变，就是高频？,对。
那么这个东西，它，它会不会，它会不会跟这个machine的话，就是说，从后面开始采的时候，他，他都是从这种噪音里面出来的，所以，所以观察到说他，他刚开始的那种变化，一个幅度会比较小？,呃，抱歉我没有理解
就是说这个现象的话，是不是，就是，呃，因为我们去采样的时候，它这个 是从一个白噪音开始的吗？ 嗯，从一个白噪音开始呢，然后我们这个 在后期，就是比如再做quantize的时候，从后往前采的时候，你刚开始采的时候，那些，它都是白噪音，所以然后就，就看起来他这个，好像是比较低频的东西？,就是白噪音它实际上是对应，就是每个 频谱，它都是 呃，每个频谱，它都是就一样，就低 频，和高频是一样的，然后后面我们generate出来。就是，最终正确的action，它是低频分量占的比较多，高频分量占的比较少，这个是比较符合真实就真实情况的，就无论是图片还是动作，它都恰好满足这个性质， 然后我们也恰好是利用了这一点。
嗯，那么就是你刚刚讲说，这个，是说用这种分层的这个图像，这个，这个，再这个，这个pixer再引入他们是吧？ 然后分层的再引入。 那分层的图像在讯的时候，又，又有一个consistency的loss。 那这些东西和分层感觉是不是有点矛盾？就分层，本来就这些，它每一层学的都不一样，那为啥我又要把它都对齐呢？,呃，这里我们是希望，就这个下标M表示的是 不同层，我们只希望这个层内的能对齐，层之间的不需要对齐。
层内的能对齐？,对，就是，比如， 我这里这个 layer20，它提取出来的feature，内部，就不同尺度，我希望它相对对齐点。  然后layer0和layer1之间的feature，它不需要对齐。
但是我们在不同的阶段，它不是用不同的尺度的去引导的吗？为什么要把这些尺度对齐呢？,呃，把这些尺度，对齐的好处是 呃，就是让它们就是从high level上，就是说没个  每个layer，它提取出来的信息是比较consistent的，但是， 但是就是， 但是实际上它是做不到的，就是完全一样的，就是我们希望  就是有第一尺度的特征，它就是保留一个 呃，高，高  这个resolution的feature，它保证了，它相当于一个高resolution feature的down sample，就大概是这种感觉。
嗯。   就是因为所用，您说的那所谓的不同尺度，都会最后把它都放到一个尺度上去做吗？ 就最后，就，就是 都变到一个尺度上去引导这个扩散模型吗？  就是说， 喂，能听到我说话吗？,呃，可以。  就是， 呃，这个，这个，它的意思就是说。 呃，如果，比如你不加这个loss，首先你也不太好训，然后第二个是  呃，如果，如果，你就是这个loss它的intuition是说， 就是我们，我们虽然是希望。 就低频，低信息度的feature，它表示低频信息，高清细度feature，表示高频信息。但是它们还是总是，再来说，需要表示的是同一个东西，就是这个图片本身，呃，本身的feature。
